id,name,details,gender,category
Men:ACCESSORIES:0,PACK OF 2 STRIPED POPLIN BOXERS,Pack of 2 pairs of boxers made of poplin fabric. Elastic waistband.,Men,ACCESSORIES
Men:ACCESSORIES:3,PACK OF 2 STRIPED POPLIN BOXERS,Pack of 2 pairs of boxers made of cotton poplin fabric. Elasticated waistband.,Men,ACCESSORIES
Men:ACCESSORIES:5,2-PACK OF SHORT POPLIN BOXERS,Pack of 2 pairs of short boxers made of cotton poplin fabric. Elasticated waistband.,Men,ACCESSORIES
Men:ACCESSORIES:7,2-PACK OF BOXERS WITH CUTWORK EMBROIDERY,Pack of 2 pairs of boxers made of poplin. Elasticated waistband. Cutwork embroidery all over the garment.,Men,ACCESSORIES
Men:ACCESSORIES:8,3-PACK OF BASIC BOXERS,Pack of 3 pairs of boxers with an elastic waistband.,Men,ACCESSORIES
Men:ACCESSORIES:10,3-PACK OF BASIC BOXERS,Pack of 3 pairs of boxers with an elasticated waistband.,Men,ACCESSORIES
Men:ACCESSORIES:16,PACK OF 3 SOFT BOXERS,Pack of three boxers with an elastic waistband. Fabric with a velvety finish.,Men,ACCESSORIES
Men:ACCESSORIES:17,PACK OF 3 SOFT BOXERS,Pack of three boxers made of a velvety-finish fabric. Elastic waistband.,Men,ACCESSORIES
Men:ACCESSORIES:18,3-PACK OF ASSORTED BOXERS,Pack of three boxers with an elastic waistband. Fabric with a faded finish.,Men,ACCESSORIES
Men:ACCESSORIES:21,3-PACK OF ASSORTED BRIEFS,Pack of 3 pairs of briefs with an elasticated waistband.,Men,ACCESSORIES
Men:ACCESSORIES:25,SMART LEATHER BELT,Leather belt. Fastening with metal buckle and belt loop.,Men,ACCESSORIES
Men:ACCESSORIES:33,LEATHER BELT,Leather belt with a nubuck finish. Fastening with metal buckle and loop.,Men,ACCESSORIES
Men:ACCESSORIES:34,FADED LEATHER BELT,Faded leather belt with metal buckle fastening.,Men,ACCESSORIES
Men:ACCESSORIES:35,THIN LEATHER BELT,Thin leather belt. Fastens with metal buckle and loop.,Men,ACCESSORIES
Men:ACCESSORIES:36,SPLIT SUEDE BELT,Leather belt with a split suede finish. Topstitching detail. Fastening with a metal buckle and belt loop.,Men,ACCESSORIES
Men:ACCESSORIES:37,CONTRAST LEATHER BELT,Leather belt. Contrast topstitching detail. Fastens with a metal buckle and loop.,Men,ACCESSORIES
Men:ACCESSORIES:38,LEATHER BELT,Leather belt. Metallic eyelets. Fastening with metallic buckle and belt loop.,Men,ACCESSORIES
Men:ACCESSORIES:40,LEATHER BELT,Leather belt. Metal loop and buckle fastening with embossed details.,Men,ACCESSORIES
Men:ACCESSORIES:41,LEATHER BELT,Thin leather belt with metal buckle fastening.,Men,ACCESSORIES
Men:ACCESSORIES:42,SPLIT SUEDE BELT,Narrow leather belt with a split suede finish. Fastening with metal buckle and loop.,Men,ACCESSORIES
Men:ACCESSORIES:43,THIN LEATHER BELT,Leather belt. Metal loop and buckle fastening.,Men,ACCESSORIES
Men:ACCESSORIES:46,BRAIDED STRETCH BELT,Elastic belt. Leather trims. Fastens with metal buckle and loop.,Men,ACCESSORIES
Men:ACCESSORIES:47,EMBOSSED LEATHER BELT,Leather belt. Embossed geometric detail. Fastening with metallic buckle and belt loop.,Men,ACCESSORIES
Men:ACCESSORIES:48,BRAIDED BELT,Plaited cotton belt. Fastening with metallic buckle and belt loop.,Men,ACCESSORIES
Men:ACCESSORIES:49,STRETCH REVERSIBLE BELT,Reversible stretch belt. Leather trims. Buckle and loop fastening.,Men,ACCESSORIES
Men:ACCESSORIES:50,REVERSIBLE LEATHER BELT,Reversible leather belt. Buckle and loop fastening.,Men,ACCESSORIES
Men:ACCESSORIES:52,REVERSIBLE LEATHER BELT,Reversible leather belt. Metal loop and buckle fastening.,Men,ACCESSORIES
Men:ACCESSORIES:54,REVERSIBLE LEATHER BELT,Reversible leather belt. Metallic buckle and loop fastening.,Men,ACCESSORIES
Men:ACCESSORIES:55,PACK OF 3 RIBBED SOCKS,Pack of three pairs of ribbed knit socks with ribbed elasticated trims.,Men,ACCESSORIES
Men:ACCESSORIES:59,3-PACK OF MERCERISED COTTON SOCKS,Pack of 3 pairs of ribbed knit socks with a mercerised cotton finish and ribbed elastic trims.,Men,ACCESSORIES
Men:ACCESSORIES:61,3-PACK OF COMBINED SOCKS,Pack of 3 pairs of lightweight socks made of a spun cotton blend fabric. Ribbed trims.,Men,ACCESSORIES
Men:ACCESSORIES:62,3-PACK OF MATCHING SOCKS,Pack of 3 pairs of socks made of a spun cotton blend fabric. Ribbed trims.,Men,ACCESSORIES
Men:ACCESSORIES:64,PACK OF 3 RIBBED SOCKS,Pack of three pairs of knit socks with ribbed trims.,Men,ACCESSORIES
Men:ACCESSORIES:65,SOCKS WITH STRIPE AND EMBROIDERY,Socks made of a spun cotton blend. Matching embroidery detail. Ribbed trims.,Men,ACCESSORIES
Men:ACCESSORIES:69,PACK OF 4 ANKLE SOCKS,Pack of four pairs of ankle socks made of a spun cotton blend fabric. Ribbed trims.,Men,ACCESSORIES
Men:ACCESSORIES:72,4-PACK OF NO-SHOW SOCKS,Pack of no-show ankle socks made of a cotton blend fabric. Ribbed trims.,Men,ACCESSORIES
Men:ACCESSORIES:74,4-PACK OF NO-SHOW SOCKS,Pack of four pairs of no-show ankle socks made of a spun cotton blend fabric. Ribbed trims.,Men,ACCESSORIES
Men:ACCESSORIES:76,4-PACK OF NO-SHOW SOCKS,Pack of four pairs of no-show socks made of a cotton blend fabric. Ribbed trims.,Men,ACCESSORIES
Men:ACCESSORIES:78,4-PACK OF NO-SHOW SOCKS,Pack of 4 pairs of no-show socks made of a spun cotton blend fabric. Ribbed trims.,Men,ACCESSORIES
Men:ACCESSORIES:87,PACK OF 3 STRIPED SOCKS,Ribbed knit socks with ribbed elastic trims. Contrast stripe detail.,Men,ACCESSORIES
Men:ACCESSORIES:93,ROLLTOP SPORTS BACKPACK,"Multi-pocket backpack. Combination of materials on the exterior. The main compartment fastens with a zip and rolls up with clip buckles on both sides. It also opens from the front with a zip closure. Two small front pockets with thermo-sealed zip fastening. Featuring two adjustable mesh pockets on the sides. Top handle and two adjustable, breathable shoulder straps. Each compartment has a thermo-sealed zip closure. Ergonomic padded back for improved comfort during use. Adjustable chest with clip buckle fastening.",Men,ACCESSORIES
Men:ACCESSORIES:94,TECHNICAL BUCKET HAT,Bucket hat made of breathable stretch fabric. Adjustable matching drawstring.Zara Athleticz.,Men,ACCESSORIES
Men:ACCESSORIES:95,NYLON BELT BAG,Soft belt bag. Technical fabric upper. Main compartment with zip closure. Front pocket with technical clasp. Adjustable handle with clip buckle.,Men,ACCESSORIES
Men:ACCESSORIES:96,ATHLETICZ LAKEN® 0.75L / 25 oz THERMOS BOTTLE,"Thermos bottle made of LAKEN® brand stainless steel. It has a cap with a screw-type closure and an automatic button to drink through the mouthpiece. 0.75 capacity.- Free of BPA, phthalates or other harmful substances.- Internal coating of polyamide varnish, free of epoxy resin, totally safe and very resistant, which completely insulates thecontent and protects it. It does not break or crack due to dents or blows- Does not retain or impart flavours- Reusable and recyclable- Hermetic closureView more",Men,ACCESSORIES
Men:ACCESSORIES:97,TECHNICAL BUCKET HAT,Hat made of lightweight technical fabric. Featuring a wide brim with topstitching detail and adjustable chin tie.Zara Athleticz.,Men,ACCESSORIES
Men:ACCESSORIES:98,TECHNICAL BACKPACK,"Multi-pocket backpack. The main compartment has zip closure and its interior has three small pockets with zip closure. Featuring two large front pockets, one with zip and the other with adjustable fastening. Side pockets with adjustable fastening. Top handle and two adjustable shoulder straps. Ergonomic padded back for improved comfort during use. Adjustable strap on the chest with clip buckle fastening.",Men,ACCESSORIES
Men:ACCESSORIES:99,SPORTS BACKPACK,Multi-pocket backpack. Combination of materials and colours on the exterior. The main compartment fastens with a zip and features an inside pocket without closure for electronic devices of up to 13 . On the front it has a flat pocket with zip closure. Adjustable mesh pockets on the sides. Top handle and two adjustable shoulder straps with zip pockets. Ergonomic padded back for improved comfort during use. Adjustable chest strap with clip buckle fastening.,Men,ACCESSORIES
Men:ACCESSORIES:100,BASEBALL TRAINING CAP,Peak cap with an adjustable strap at the back.Zara Athleticz.,Men,ACCESSORIES
Men:ACCESSORIES:102,CAP,"Cap made of stretchy, breathable fabric. Secure fit with inner elastic band.Zara Athleticz.",Men,ACCESSORIES
Men:ACCESSORIES:103,PACK OF 3 TRAINING SOCKS,Pack of 3 pairs of socks made of a spun cotton blend fabric. Ribbed trims.Zara Athleticz.,Men,ACCESSORIES
Men:ACCESSORIES:107,PACK OF 2 TRAINING SOCKS,Pack of 2 pairs of seamless socks with ribbed trims.Zara Athleticz.,Men,ACCESSORIES
Men:ACCESSORIES:109,TRAINING SOCKS,Pack of 2 pairs of seamless mesh socks with ribbed trims.,Men,ACCESSORIES
Men:ACCESSORIES:110,GEOMETRIC PRINT SWIMMING TRUNKS,Swimming trunks made of technical fabric with a velvety finish. Elasticated waistband with drawstrings. Front pockets and pocket detail at the waist. Rear welt pocket. Lining. Includes a bag in the same fabric.,Men,ACCESSORIES
Men:ACCESSORIES:112,LONG CARGO SWIMMING TRUNKS,Swimming trunks made of a velvety-finish technical fabric. Elasticated waistband and adjustable drawstring. Front pockets and a rear pocket. Patch pocket appliqué with a flap on the leg. Lining.,Men,ACCESSORIES
Men:ACCESSORIES:113,STRIPE PRINT SWIMMING TRUNKS,Swimming trunks made of a technical fabric. Elasticated waistband and adjustable drawstring. Side pockets and a rear pocket. Lining.,Men,ACCESSORIES
Men:ACCESSORIES:116,BASIC SWIMMING TRUNKS,Swimming trunks made of a technical fabric. Elasticated waistband and adjustable drawstrings. Side pockets and a back patch pocket. Lining.,Men,ACCESSORIES
Men:ACCESSORIES:117,ACID WASH SWIMMING TRUNKS,Swimming trunks made of technical fabric. Adjustable elasticated drawstring waistband. Side pockets and back pocket detail. Lining. Side slits at the hems. Faded acid wash.,Men,ACCESSORIES
Men:ACCESSORIES:118,MOSAIC PRINT SWIMMING TRUNKS,Swimming trunks made of technical fabric. Elasticated waistband with adjustable drawstring. Side pockets and a rear patch pocket with a flap. Lining.,Men,ACCESSORIES
Men:ACCESSORIES:119,LONG SWIMMING TRUNKS WITH SUN DETAIL,Swimming trunks made of a velvety-finish technical fabric. Elasticated waistband with adjustable drawstring. Front pockets and a rear zip pocket. Lining.,Men,ACCESSORIES
Men:ACCESSORIES:120,FLORAL PRINT SWIMMING TRUNKS,Swimming trunks made of technical fabric. Elasticated waistband with adjustable drawstring. Front pockets and rear welt pocket. Lining. Includes a bag in the same fabric.,Men,ACCESSORIES
Men:ACCESSORIES:121,STRIPE PRINT SWIMMING TRUNKS,Swimming trunks made of a technical fabric. Elasticated waistband and adjustable drawstring. Side pockets and a rear patch pocket. Lining.,Men,ACCESSORIES
Men:ACCESSORIES:122,LONG SWIMMING TRUNKS,Swimming trunks made of a technical fabric. Elastic waistband and adjustable drawstring. Side pockets and a back patch pocket. Lining.,Men,ACCESSORIES
Men:ACCESSORIES:123,SEERSUCKER SWIMMING TRUNKS,Swimming trunks made of a technical fabric. Elastic waistband and adjustable drawstring. Side pockets and a back patch pocket. Lining.,Men,ACCESSORIES
Men:ACCESSORIES:124,BASIC SWIMMING TRUNKS,Swimming trunks made of a technical fabric. Elasticated waistband and adjustable drawstrings. Side pockets and a back patch pocket. Lining.,Men,ACCESSORIES
Men:ACCESSORIES:130,SEERSUCKER SWIMMING TRUNKS,Swimming trunks made of a technical fabric. Elasticated waistband and adjustable drawstrings. Side pockets and a back patch pocket. Lining.,Men,ACCESSORIES
Men:ACCESSORIES:134,TECHNICAL CHECK TEXTURE SWIMMING TRUNKS,Swimming trunks made of technical fabric. Elasticated waistband. Side pockets and back patch pocket with flap. Lining.,Men,ACCESSORIES
Men:ACCESSORIES:135,CHECKED TECHNICAL SWIMMING TRUNKS,Swimming trunks made of a technical fabric. Adjustable elasticated waistband with drawstring. Side pockets and back welt pocket. Lining.,Men,ACCESSORIES
Men:ACCESSORIES:136,GEOMETRIC PRINT SWIMMING TRUNKS,Swimming trunks made of a technical fabric. Elasticated waistband and adjustable drawstring. Side pockets and a back patch pocket. Lining.,Men,ACCESSORIES
Men:ACCESSORIES:137,LONG TIE-DYE SWIMMING TRUNKS,Swimming trunks made of technical fabric. Adjustable elasticated waistband. Front pockets and back zip pocket. Lining.,Men,ACCESSORIES
Men:ACCESSORIES:139,ABSTRACT PRINT SWIMMING TRUNKS,Swimming trunks made of technical fabric. Elasticated waistband and adjustable drawstring. Front welt pockets and back patch pocket detail. Lining.,Men,ACCESSORIES
Men:ACCESSORIES:140,DIAMOND PRINT SWIMMING TRUNKS,Swimming trunks made of a velvety-finish technical fabric. Elasticated waistband and adjustable drawstring. Side pockets and a back welt pocket. Lining.,Men,ACCESSORIES
Men:ACCESSORIES:142,FLORAL PRINT SWIMMING TRUNKS,Swimming trunks made of technical fabric. Adjustable elasticated waistband with drawstring. Side pockets and back patch pocket with flap. Lining.,Men,ACCESSORIES
Men:ACCESSORIES:145,BLEND PRINT SWIMMING TRUNKS,Swimming trunks made of a velvety-finish technical fabric. Elasticated waistband and adjustable drawstring. Side pockets and a back patch pocket. Lining.,Men,ACCESSORIES
Men:ACCESSORIES:146,LONG PRINTED SWIMMING TRUNKS,Swimming trunks made of a technical fabric. Elasticated waistband and adjustable drawstrings. Side pockets and a back patch pocket. Lining.,Men,ACCESSORIES
Men:ACCESSORIES:147,PAISLEY PRINT SWIMMING TRUNKS,Swimming trunks made of a velvety-finish technical fabric. Elasticated waistband and adjustable drawstrings. Side pockets and a rear patch pocket. Lining.,Men,ACCESSORIES
Men:ACCESSORIES:148,LONG GEOMETRIC PRINT SWIMMING TRUNKS,Swimming trunks made of a velvety-finish technical fabric. Elasticated waistband and adjustable drawstrings. Side pockets and a rear patch pocket. Lining.,Men,ACCESSORIES
Men:ACCESSORIES:149,CARGO SWIM SHORTS,Swimming trunks made of technical fabric with a velvety finish. Adjustable elasticated waist with drawstring. Contrast trim detail. Rear patch pocket. Patch pockets on the legs. Side vents at the hem. Lining.,Men,ACCESSORIES
Men:ACCESSORIES:150,SEERSUCKER SWIMMING TRUNKS,Swimming trunks made of technical fabric. Elasticated waistband. Front pockets and side zip pocket detail. Patch pocket at the back. Lining. Side vents at the hem. Zip fly and snap-button fastening.,Men,ACCESSORIES
Men:ACCESSORIES:151,SLOGAN PRINT SWIMMING TRUNKS,Swimming trunks made of a technical fabric. Elasticated waistband and adjustable drawstring. Side pockets and a back patch pocket. Lining.,Men,ACCESSORIES
Men:ACCESSORIES:152,GEOMETRIC PRINT SWIMMING TRUNKS,Swimming trunks made of a technical fabric. Adjustable elasticated waistband with drawstring. Front pockets and rear welt pocket detail. Lining.,Men,ACCESSORIES
Men:ACCESSORIES:153,GEOMETRIC PRINT SWIMMING TRUNKS,Swimming trunks made of technical fabric. Elasticated waistband and adjustable drawstrings. Side pockets and a back patch pocket. Lining. Side vents at the hem.,Men,ACCESSORIES
Men:ACCESSORIES:154,FISH PRINT SWIMMING TRUNKS,Swimming trunks made of technical fabric. Adjustable elasticated waistband with drawstring. Side pockets and a back patch pocket. Lining.,Men,ACCESSORIES
Men:ACCESSORIES:155,LONG SWIMMING TRUNKS,Swimming trunks made of a technical fabric. Adjustable elasticated waistband with drawstring. Front pockets and back zip pocket. Lining.,Men,ACCESSORIES
Men:ACCESSORIES:157,TIE-DYE PRINT SWIMMING TRUNKS,Swimming trunks made of a technical fabric. Adjustable elasticated waistband. Side pockets and a rear patch pocket. Lining.,Men,ACCESSORIES
Men:ACCESSORIES:158,LONG TIE-DYE SWIMMING TRUNKS,Swimming trunks made of technical fabric. Adjustable elasticated waistband. Front pockets and back zip pocket. Lining.,Men,ACCESSORIES
Men:ACCESSORIES:159,STRIPED TECHNICAL SWIMMING TRUNKS,Swimming trunks made of a technical fabric. Adjustable elasticated waistband with side tabs. Front pockets and back patch pocket. Lining.,Men,ACCESSORIES
Men:ACCESSORIES:160,100% LINEN PAREO,Lightweight pareo made of linen. Featuring a contrast stripe and frayed trims.Measurements: 100 x 200 . / 39.3 x 78.7″,Men,ACCESSORIES
Men:ACCESSORIES:161,GEOMETRIC JACQUARD BEACH TOWEL,Beach towel made of terry cotton.Measurements: 91 x 180 / 35.8 x 70.8″,Men,ACCESSORIES
Men:ACCESSORIES:162,RECTANGULAR SUNGLASSES - LIMITED EDITION,Sunglasses with a rectangular acetate frame. Case included.UV/UVA 400 protection. Category 1.,Men,ACCESSORIES
Men:ACCESSORIES:164,OVAL SUNGLASSES - LIMITED EDITION,Sunglasses with an oval acetate frame. Case included.UV/UVA 400 protection. Category 1.,Men,ACCESSORIES
Men:ACCESSORIES:165,PREMIUM SQUARE SUNGLASSES,Sunglasses with a square tortoiseshell-effect acetate frame. Polarised lenses. Case included.UV/UVA 400 protection. Category 1.,Men,ACCESSORIES
Men:ACCESSORIES:166,PREMIUM SQUARE SUNGLASSES,Sunglasses with a square acetate frame. Polarised lenses. Case included.UV/UVA 400 protection. Category 1.,Men,ACCESSORIES
Men:ACCESSORIES:167,RECTANGULAR SUNGLASSES,Sunglasses with an acetate frame. Polarised lenses. Case included.UV/UVA 400 protection. Category 3.Origins special collection.,Men,ACCESSORIES
Men:ACCESSORIES:168,100% SILK TEXTURED TIE,Wide tie made of textured silk fabric.,Men,ACCESSORIES
Men:ACCESSORIES:172,100% SILK WIDE TIE,Wide tie made of silk with diagonal texture.,Men,ACCESSORIES
Men:ACCESSORIES:176,100% SILK SKINNY TIE,Skinny tie made of textured silk.,Men,ACCESSORIES
Men:ACCESSORIES:178,100% SILK TEXTURED TIE,Wide tie made of silk fabric.,Men,ACCESSORIES
Men:ACCESSORIES:181,JACQUARD TIE WITH CYCLIST,Wide tie made of a silk and cotton blend.,Men,ACCESSORIES
Men:ACCESSORIES:182,SILK - WOOL JACQUARD TIE,Wide tie made of a silk and wool blend.,Men,ACCESSORIES
Men:ACCESSORIES:190,SILK OTTOMAN BOW TIE,Bow tie made of silk. Adjustable elastic with metal hook.,Men,ACCESSORIES
Men:ACCESSORIES:192,DENIM CAP,Faded peak cap. Adjustable at the back.,Men,ACCESSORIES
Men:ACCESSORIES:193,SOFT CAP,Peak cap with an adjustable strap at the back.,Men,ACCESSORIES
Men:ACCESSORIES:200,FADED TEXTURED CAP,Peak cap. Embroidered detail on the back. Adjustable drawstrings.,Men,ACCESSORIES
Men:ACCESSORIES:203,TEXTURED CAP,Peak cap with an adjustable strap fastening in the back.,Men,ACCESSORIES
Men:ACCESSORIES:204,TEXTURED PEAK CAP,Visor with an adjustable strap at the back.,Men,ACCESSORIES
Men:ACCESSORIES:205,CAP WITH CONTRAST PATCH,Peak cap with a contrast patch detail on the front. Adjustable at the back.,Men,ACCESSORIES
Men:ACCESSORIES:206,CAP WITH CONTRAST EMBROIDERY,Peak cap. Contrast embroidered detail on the front. Adjustable at the back.,Men,ACCESSORIES
Men:ACCESSORIES:207,CAP WITH EMBROIDERED SLOGAN,Peak cap with a matching embroidery slogan on the front. Adjustable fastening at the back.,Men,ACCESSORIES
Men:ACCESSORIES:209,CAP WITH EMBROIDERED SLOGAN,Peak cap with a contrast embroidery slogan on the front. Adjustable fastening at the back.,Men,ACCESSORIES
Men:ACCESSORIES:214,2-PACK OF STONE RINGS,Pack of two metal rings with contrast stone. 925 MM silver-plated finish.Measurements:Size M: Circumference: 61 . // Diameter: 19.4 .Size L: Circumference: 63 . // Diameter: 20 .,Men,ACCESSORIES
Men:ACCESSORIES:215,SIGNET RING,Metal signet ring. Aged finish.Measurements:Size M: Circumference: 61 . // Diameter: 19.4 .Size L: Circumference: 63 . // Diameter: 20 .,Men,ACCESSORIES
Men:ACCESSORIES:217,SIGNET RING,Metal signet ring. Measurements:Size M: Circumference: 61 . // Diameter: 19.4 .Size L: Circumference: 63 . // Diameter: 20 .,Men,ACCESSORIES
Men:ACCESSORIES:218,BAND RING,Metal ring. 925 MM silver-plated finish.Measurements:Size M: Circumference: 61 . // Diameter: 19.4 .Size L: Circumference: 63 . // Diameter: 20 .,Men,ACCESSORIES
Men:ACCESSORIES:220,CONTRAST SIGNET RING,Metal contrast signet ring. 925 MM silver-plated finish.Measurements:Size M: Circumference: 61 . // Diameter: 19.4 .Size L: Circumference: 63 . // Diameter: 20 .,Men,ACCESSORIES
Men:ACCESSORIES:221,CHAIN WITH GEOMETRIC PENDANT,Metal chain with matching geometric pendant. Lobster clasp fastening.Length: Medium.,Men,ACCESSORIES
Men:ACCESSORIES:222,METAL LINK CHAIN,Chain comprising metal chain links. Bar closure.Length: Medium.,Men,ACCESSORIES
Men:ACCESSORIES:223,CHAIN PENDANT,Metal chain with matching pendant detail. 925 MM silver-plated finish. Lobster clasp fastening.Length: Medium.,Men,ACCESSORIES
Men:ACCESSORIES:224,METAL LINK CHAIN,Chain comprising metal chain links. Lobster clasp closure.Length: Medium.,Men,ACCESSORIES
Men:ACCESSORIES:225,METAL LINK CHAIN,Chain comprising metal links with a 925 MM silver-plated finish. Lobster clasp fastening.Length: Medium.,Men,ACCESSORIES
Men:ACCESSORIES:227,CONTRAST CHAIN WITH PEARL BEADS,Contrast metal chain with pearl beads. 925 MM silver-plated finish. Lobster clasp fastening.Length: Medium.,Men,ACCESSORIES
Men:ACCESSORIES:228,ENGRAVED CHAIN LINK BRACELET,Bracelet comprising metal links with engraved slogan detail. Clasp fastening.,Men,ACCESSORIES
Men:ACCESSORIES:229,CHAIN LINK BRACELET,Bracelet comprising metal links with a 925 MM silver-plated finish. Lobster clasp fastening.,Men,ACCESSORIES
Men:ACCESSORIES:230,BRACELET WITH METAL LINKS,Bracelet with metal chain links. Lobster clasp closure.,Men,ACCESSORIES
Men:ACCESSORIES:231,IRREGULAR RIGID BRACELET,Open metal bracelet. Irregular 925 MM silver-plated finish.,Men,ACCESSORIES
Men:ACCESSORIES:232,MINI NYLON MESSENGER BAG,Crossbody bag. Soft design. The main compartment is under the flap and fastens with a metal hook. Adjustable strap.,Men,ACCESSORIES
Men:ACCESSORIES:236,MINI CROSSBODY BAG WITH FLAP,Crossbody bag. Soft construction. The main compartment has zip closure and the inside has a small pocket without closure. Front pocket with magnetic closure and flap. Adjustable and detachable shoulder strap.,Men,ACCESSORIES
Men:ACCESSORIES:237,BAG WITH MULTIPLE POCKETS,Handbag. Multiple detachable pockets on a central hoop. Main bag with zip closure. The inside has four small pockets without closures. Second small bucket bag with gathered drawstring closure. Third small bag that can be used as a purse or a case for headphones (compatible with AirPods® sizes). Adjustable shoulder strap.Main pocket: Length x height: 19 x 12 / 7.4 x 4.7″Bucket pocket: Length x height x width: 8 x 10 x 8 . / 3.1 x 3.9 x 3.1″Purse pocket:,Men,ACCESSORIES
Men:ACCESSORIES:239,DENIM EARPHONE BAG,Earphone bag made of denim. Zip closure. Adjustable and detachable cord.,Men,ACCESSORIES
Men:ACCESSORIES:240,NYLON MULTI-POCKET BAG,Handbag. Multiple detachable pockets on a central hoop. Main bag with zip closure. The inside has four small pockets without closures. Second small bucket bag with gathered drawstring closure. Third small bag that can be used as a purse or a case for headphones (compatible with AirPods® sizes). Adjustable shoulder strap.Main pocket: Length x height: 19 x 12 / 7.4 x 4.7″Bucket pocket: Length x height x width: 8 x 10 x 8 / 3.1 x 3.9 x 3.1″Purse pocket:,Men,ACCESSORIES
Men:ACCESSORIES:241,HOOP EARRINGS,Metal earrings. Push-back closure.,Men,ACCESSORIES
Men:ACCESSORIES:242,IRREGULAR EARRINGS,Earrings with an irregular finish. Push-back fastening.,Men,ACCESSORIES
Men:ACCESSORIES:243,EARRINGS,Metal earrings. 925 MM silver-plated finish. Push-back clasps.,Men,ACCESSORIES
Men:ACCESSORIES:244,BUCKET HAT,Hat made of cotton fabric. Wide brim with topstitching detail. Frayed trim. Faded effect.,Men,ACCESSORIES
Men:ACCESSORIES:248,UTILITY HAT,Wide-brimmed hat with topstitching detail. Zip pocket. Adjustable drawstring.,Men,ACCESSORIES
Men:ACCESSORIES:251,STRIPED CROCHET HAT,Hat made of spun cotton fabric.,Men,ACCESSORIES
Men:ACCESSORIES:253,WOVEN BUCKET HAT,Woven hat with an open texture.,Men,ACCESSORIES
Men:ACCESSORIES:255,CONTRAST CROCHET HAT,Hat made of spun cotton thread. Contrast topstitching on the brim.,Men,ACCESSORIES
Men:ACCESSORIES:256,TEXTURED BUCKET HAT,Hat made of textured ripstop fabric that is resistant to tearing. Wide brim with topstitching detail.,Men,ACCESSORIES
Men:ACCESSORIES:260,BUCKET HAT WITH CONTRAST TOPSTITCHING,Hat made of cotton fabric. Wide brim with contrast topstitching detail and frayed trim.,Men,ACCESSORIES
Men:ACCESSORIES:261,TEXTURED BUCKET HAT,Hat made of cotton fabric. Brim with topstitching detail. Faded effect.,Men,ACCESSORIES
Men:ACCESSORIES:263,DENIM BUCKET HAT,Hat made of denim fabric. Faded effect.,Men,ACCESSORIES
Men:ACCESSORIES:265,BUCKET HAT,Hat made of cotton fabric. Wide brim with topstitching detail. Faded effect.,Men,ACCESSORIES
Men:ACCESSORIES:267,SHORT BEANIE,Adjustable hat made of textured rip-stop fabric that is resistant to tearing. Turn-up brim.,Men,ACCESSORIES
Men:ACCESSORIES:270,TEXTURED COTTON FLAT CAP,Flat cap with visor. Adjustable elastic.,Men,ACCESSORIES
Men:ACCESSORIES:273,TIE-DYE PRINT BANDANA,Bandana made of cotton.Measurements: 60 x 60 . / 23.6 x 23.6″,Men,ACCESSORIES
Men:ACCESSORIES:276,GEOMETRIC EMBROIDERY BANDANA,Bandana made of cotton. Contrast embroidery.Measurements: 60 x 60 . / 23.6 x 23.6″,Men,ACCESSORIES
Men:ACCESSORIES:282,ABSTRACT PRINT BANDANA,Bandana made of cotton. Measurements: 60 x 60 . / 23.6 x 23.6″,Men,ACCESSORIES
Men:ACCESSORIES:283,PAISLEY PRINT BANDANNA,Bandana made of cotton.Measurements: 60 x 60 / 23.6 x 23.6″,Men,ACCESSORIES
