id,name,details,gender,category
Women:TOPS_BODYSUITS:0,SATIN STRAPLESS TOP,"Top with a straight neckline and exposed shoulders. Featuring matching lining, an asymmetric hem and back zip fastening.",Women,TOPS_BODYSUITS
Women:TOPS_BODYSUITS:1,STRETCH TOP,Fitted top with a square-cut neckline and straps. Fastens at the back with a metal zip.,Women,TOPS_BODYSUITS
Women:TOPS_BODYSUITS:2,FOIL HALTER TOP,V-neck halter top made of metallic fabric. Lining. Open back. Invisible side zip fastening.,Women,TOPS_BODYSUITS
Women:TOPS_BODYSUITS:3,ASYMMETRIC HALTERNECK TOP,"Top made of pleated satin fabric with a halter neck. Featuring an open back, asymmetric hem and button fastening at the neck.",Women,TOPS_BODYSUITS
Women:TOPS_BODYSUITS:4,LINEN BLEND CROP TOP,Short top made of a linen blend. Straight neckline and exposed shoulders. Pleated detail on the front.,Women,TOPS_BODYSUITS
Women:TOPS_BODYSUITS:5,RIBBED KNIT TOP,Sleeveless top made of a cotton blend. Featuring a round neckline.,Women,TOPS_BODYSUITS
Women:TOPS_BODYSUITS:6,METALLIC MESH KNIT TOP,Top with a round neck and long sleeves. Matching ribbed trims.,Women,TOPS_BODYSUITS
Women:TOPS_BODYSUITS:7,PLEATED TOP WITH BELT,Sleeveless top featuring a high neck with pleat detail. Tied belt in the same fabric. Concealed buttoned opening at the back.,Women,TOPS_BODYSUITS
Women:TOPS_BODYSUITS:8,OPEN KNIT CAPE,Cape in a textured open knit fabric with an asymmetric neck and sleeve.,Women,TOPS_BODYSUITS
Women:TOPS_BODYSUITS:9,HALTER NECK BODYSUIT,Halter neck bodysuit with snap-button fastening at the bottom.,Women,TOPS_BODYSUITS
Women:TOPS_BODYSUITS:12,PLEATED OPEN-BACK TOP,High neck top with long sleeves. Open back detail. Invisible side zip fastening and buttons.,Women,TOPS_BODYSUITS
Women:TOPS_BODYSUITS:13,SLEEVELESS CABLE-KNIT TOP,Sleeveless round neck top.,Women,TOPS_BODYSUITS
Women:TOPS_BODYSUITS:14,MESH SEAMLESS TOP WITH RHINESTONES,Top made of stretchy mesh fabric. Round neck and long sleeves. Rhinestone appliqué details.,Women,TOPS_BODYSUITS
Women:TOPS_BODYSUITS:15,BEADED CROCHET TOP,Crochet top with multicoloured beads. Round neck and back fastening.,Women,TOPS_BODYSUITS
Women:TOPS_BODYSUITS:16,SHORT CROCHET TOP,"Crochet crop top with a V-neckline, wide straps and cutwork fabric detail.",Women,TOPS_BODYSUITS
Women:TOPS_BODYSUITS:17,RHINESTONE TOP,Crop top featuring a straight neckline and wide straps. Metal chain fastening at the back.,Women,TOPS_BODYSUITS
Women:TOPS_BODYSUITS:18,DRAPED FOIL TOP,Metallic thread top with an asymmetric neckline and draped fabric detail.,Women,TOPS_BODYSUITS
Women:TOPS_BODYSUITS:19,PRINTED KIMONO SHIRT,V-neck kimono shirt with full sleeves falling below the elbow. Front fastening with covered buttons in matching fabric.,Women,TOPS_BODYSUITS
Women:TOPS_BODYSUITS:20,TRF DENIM CROP TOP,Sleeveless crop top with a round neck. Seamless hem. Fastens at the back with an opening and metal button.,Women,TOPS_BODYSUITS
Women:TOPS_BODYSUITS:21,JACQUARD KNIT TOP,Top featuring a slot collar with a drawstring and short sleeves.,Women,TOPS_BODYSUITS
Women:TOPS_BODYSUITS:22,ASYMMETRIC TOP,Top with an asymmetric neckline and exposed shoulders. Gathered detail on the side. Asymmetric hem with side vent.,Women,TOPS_BODYSUITS
Women:TOPS_BODYSUITS:23,STRAPLESS TOP WITH BUCKLES,Off-the-shoulder top with a straight neckline. Tab details with metallic buckles. Asymmetric hem. Invisible side zip fastening.,Women,TOPS_BODYSUITS
Women:TOPS_BODYSUITS:24,CONTRAST WAISTCOAT TOP,Sleeveless V-neck top with satin lapels and metal button fastening at the front.,Women,TOPS_BODYSUITS
Women:TOPS_BODYSUITS:25,STRAPLESS CORSETRY-INSPIRED TOP WITH RHINESTONES,Off-the-shoulder top with a straight-cut neckline. Rhinestone details. Matching lining. Invisible side zip fastening.,Women,TOPS_BODYSUITS
Women:TOPS_BODYSUITS:26,BODYSUIT WITH SQUARE-CUT NECKLINE,Square-neck bodysuit with wide straps. Snap-button fastening at the bottom.,Women,TOPS_BODYSUITS
Women:TOPS_BODYSUITS:27,TEXTURED JACQUARD TOP,ROUND NECK - NORMAL LENGTH - SHORT SLEEVESRound neck T-shirt with short sleeves. Textured fabric detail.,Women,TOPS_BODYSUITS
Women:TOPS_BODYSUITS:28,DRAPED TULLE TOP,Semi-sheer V-neck top featuring long sleeves with mittens. Draped fabric. Button-up front.This garment is not lined.,Women,TOPS_BODYSUITS
Women:TOPS_BODYSUITS:29,SEAMLESS RHINESTONES BODYSUIT,Bodysuit made of stretchy mesh fabric. Round neck and long sleeves. Rhinestone appliqué details.,Women,TOPS_BODYSUITS
Women:TOPS_BODYSUITS:30,TAILORED LINEN BLEND WAISTCOAT,Sleeveless waistcoat made of a linen blend with a lapel collar and V-neck. Tied hem in the same fabric.,Women,TOPS_BODYSUITS
Women:TOPS_BODYSUITS:31,TRF ASYMMETRIC DENIM TOP,"Halter top with a V-neckline. Featuring flap detail on the chest, an asymmetric hem and metal zip fastening on the side.",Women,TOPS_BODYSUITS
Women:TOPS_BODYSUITS:32,PRINTED TOP WITH TIED DETAIL,"Sleeveless top made of cotton. Featuring a round neck, adjustable hem with ties and button fastening at the back.",Women,TOPS_BODYSUITS
Women:TOPS_BODYSUITS:33,BLOUSE WITH BOW COLLAR,"High-neck blouse with a bow, long puff sleeves and a buttoned opening at the back.",Women,TOPS_BODYSUITS
Women:TOPS_BODYSUITS:34,LINEN BLEND ASYMMETRIC TOP,Top made of a cotton and linen blend. Asymmetric neckline and long cape sleeves. Textured fabric detail. Asymmetric hem.,Women,TOPS_BODYSUITS
Women:TOPS_BODYSUITS:35,TOP WITH PLEATED RUFFLE SLEEVES,Crop top featuring a round neck and long sleeves with pleated ruffle trims. Buttoned opening at the back.,Women,TOPS_BODYSUITS
Women:TOPS_BODYSUITS:36,STRAPLESS POPLIN TOP WITH BEADING,Off-the-shoulder top with a straight-cut neckline. Featuring pleats and contrast beads. Metal zip fastening at the back.,Women,TOPS_BODYSUITS
Women:TOPS_BODYSUITS:37,TOP WITH BRAIDED STRAPS,V-neck top featuring braided straps with tied detail at the back. Elastic detail and opening at the back.,Women,TOPS_BODYSUITS
Women:TOPS_BODYSUITS:38,ASYMMETRIC GATHERED TOP,Top made of a polyamide and elastane blend. Asymmetric neckline with exposed shoulders. Gathered fabric detail.,Women,TOPS_BODYSUITS
Women:TOPS_BODYSUITS:39,TEXTURED RUFFLED TOP,Sleeveless V-neck top. Textured fabric detail and ruffles.,Women,TOPS_BODYSUITS
Women:TOPS_BODYSUITS:42,SATINY STRAPLESS NECKERCHIEF TOP,Off-the-shoulder top with a straight neckline. Neckerchief fabric with pleat details. Invisible side zip fastening.,Women,TOPS_BODYSUITS
Women:TOPS_BODYSUITS:43,PRINTED LINEN BLEND TOP,Halter top made of a linen blend. V-neckline. Open back. Asymmetric hem with a front slit. Side metal zip fastening.,Women,TOPS_BODYSUITS
Women:TOPS_BODYSUITS:45,POPLIN TOP WITH RHINESTONES AND FLOWERS,Top with thin straps and a tie at the back. Featuring a neckline in the shape of flowers and rhinestone appliqués.,Women,TOPS_BODYSUITS
Women:TOPS_BODYSUITS:46,EMBELLISHED CUT-OUT BODYSUIT,Bodysuit with a plunging V-neckline and wide straps. Metal appliqué detail on the chest and cut-out sides. Draped fabric. Snap-button fastening at the bottom.,Women,TOPS_BODYSUITS
Women:TOPS_BODYSUITS:47,TRF DENIM CROP TOP WITH RHINESTONES,Crop top with a straight neckline and thin straps. Rhinestone details. Fastens at the back with metal zip.,Women,TOPS_BODYSUITS
Women:TOPS_BODYSUITS:48,COMBINED STRIPED TOP,Sleeveless round neck top made of cotton. Featuring contrast fabric on the front with darts and a buttoned opening at the back.,Women,TOPS_BODYSUITS
Women:TOPS_BODYSUITS:49,CROSSOVER TOP WITH RUFFLES,Semi-sheer top with a surplice neckline and long sleeves. Ruffle trim details. This garment is not lined.,Women,TOPS_BODYSUITS
Women:TOPS_BODYSUITS:50,CROCHET BRALETTE,Crochet bralette in a combination of contrast colours. Tied fastening in the same fabric.,Women,TOPS_BODYSUITS
Women:TOPS_BODYSUITS:51,METALLIC THREAD RUSTIC SWEATER,Round neck sweater with long sleeves and metallic thread detail.This garment is not lined.,Women,TOPS_BODYSUITS
Women:TOPS_BODYSUITS:52,OPEN-BACK TOP WITH BUCKLE,V-neck top with a halter neck. Features an open back with double buckle and hidden hook-and-eye fastening at the front.,Women,TOPS_BODYSUITS
Women:TOPS_BODYSUITS:53,ASYMMETRIC PLEATED TOP,Top with an asymmetric neckline and a wide strap. Pleated fabric with ruffle trims.,Women,TOPS_BODYSUITS
Women:TOPS_BODYSUITS:54,CREASED-EFFECT SATIN HALTER TOP,Halter top with a buttoned opening at the back.,Women,TOPS_BODYSUITS
Women:TOPS_BODYSUITS:56,DRAPED TULLE PRINT TOP,Semi-sheer V-neck top featuring long sleeves with mittens. Draped fabric. Button-up front.,Women,TOPS_BODYSUITS
Women:TOPS_BODYSUITS:57,ASYMMETRIC DRAPED TOP,Top with an asymmetric neckline and wide straps. Draped fabric. Asymmetric hem.,Women,TOPS_BODYSUITS
Women:TOPS_BODYSUITS:58,ASYMMETRIC TOP WITH TIES,Sleeveless top with an asymmetric neckline. Side pleats. Tied belt in the same fabric.,Women,TOPS_BODYSUITS
Women:TOPS_BODYSUITS:59,OVERSIZE KNIT T-SHIRT,Shirt with a round neckline and short sleeves.,Women,TOPS_BODYSUITS
Women:TOPS_BODYSUITS:60,PRINTED TULLE TOP,Short sleeve top with a high neck. Draped fabric. Lining. Invisible back zip fastening.,Women,TOPS_BODYSUITS
Women:TOPS_BODYSUITS:61,METALLIC THREAD KNIT TOP,Sleeveless round neck top.This garment is not lined.,Women,TOPS_BODYSUITS
Women:TOPS_BODYSUITS:62,METALLIC THREAD KNIT TOP,Sleeveless top with a round neckline and metallic thread detail.,Women,TOPS_BODYSUITS
Women:TOPS_BODYSUITS:63,TEXTURED TOP WITH RUFFLE TRIMS,Sleeveless top made of textured fabric. Featuring a round neck and ruffled trims in matching fabric.,Women,TOPS_BODYSUITS
Women:TOPS_BODYSUITS:65,EMBROIDERED TOP,OVERSIZE FIT - V-NECK - LONG - SHORT SLEEVESTop made of a viscose blend. V-neckline and short sleeves. Contrast embroidery detail. Side vents at the hem.,Women,TOPS_BODYSUITS
Women:TOPS_BODYSUITS:66,METALLIC TOP WITH RHINESTONES,Sleeveless metallic crop top with rhinestone appliqués. Round neck. Open back. Lobster clasp fastening.This garment is not lined.,Women,TOPS_BODYSUITS
Women:TOPS_BODYSUITS:67,PLEATED TOP WITH KNOT,Strappy halter top with front knot. Invisible side zip fastening.,Women,TOPS_BODYSUITS
Women:TOPS_BODYSUITS:68,CROCHET CROP TOP,V-neck crop top with tie detail at the neck. Matching crochet fabric. Ruffled hem with cutwork embroidery. Tied fastening at the back.,Women,TOPS_BODYSUITS
Women:TOPS_BODYSUITS:69,PRINTED LINEN BLEND CROP TOP,Top made of a linen blend. Featuring a knotted V-neck and short sleeves. Invisible side zip fastening.,Women,TOPS_BODYSUITS
Women:TOPS_BODYSUITS:70,RUFFLED KNIT TOP,Sleeveless top with a V-neck and ruffles.,Women,TOPS_BODYSUITS
Women:TOPS_BODYSUITS:71,SEAMLESS CROP TOP WITH RHINESTONES,"Off-the-shoulder crop top with a straight neckline. Featuring long sleeves, a hem with metal fringing and rhinestone appliqués.",Women,TOPS_BODYSUITS
Women:TOPS_BODYSUITS:72,SATIN OPEN-BACK TOP,Round neck top with long sleeves and pleated cuffs. Open back. Gathered detailing at the sides. Tied bow at the hem.,Women,TOPS_BODYSUITS
Women:TOPS_BODYSUITS:73,EMBROIDERED CROP TOP,V-neck crop top featuring short puff sleeves with elasticated trim. Knot detail with front pleats. Asymmetric hem with matching trim.,Women,TOPS_BODYSUITS
Women:TOPS_BODYSUITS:74,FLORAL PRINT SATIN TOP,Top featuring a crossover high neck with multi-way tied detail at the back. Long sleeves.,Women,TOPS_BODYSUITS
Women:TOPS_BODYSUITS:75,Z1975 DENIM CROPPED WAISTCOAT,V-neck waistcoat with front metal button fastening.,Women,TOPS_BODYSUITS
Women:TOPS_BODYSUITS:77,TRF DENIM TOP,Top with a straight-cut neckline and adjustable straps. Front patch pockets. Elastic smocked fabric detail at the back. Front zip fastening.,Women,TOPS_BODYSUITS
Women:TOPS_BODYSUITS:78,DENIM TRF SHIRT,Faded denim shirt with a round neck and short sleeves. Featuring seamless trims and metal zip fastening at the back.,Women,TOPS_BODYSUITS
Women:TOPS_BODYSUITS:79,ASYMMETRIC GATHERED TOP,Sleeveless round neck top made of stretch fabric. Featuring an asymmetric hem and a buttoned opening at the back.,Women,TOPS_BODYSUITS
Women:TOPS_BODYSUITS:80,RIBBED KNIT CROP TOP,Round neck top with wide straps.,Women,TOPS_BODYSUITS
Women:TOPS_BODYSUITS:81,RHINESTONE POPLIN TOP,Top with a sweetheart neckline and thin straps. Featuring a cut-out detail on the chest and rhinestone appliqués.,Women,TOPS_BODYSUITS
Women:TOPS_BODYSUITS:85,KNIT CROSSOVER HALTER TOP,Crossover halterneck top with wide straps.,Women,TOPS_BODYSUITS
Women:TOPS_BODYSUITS:86,CROP TOP,Round neck top with short sleeves.,Women,TOPS_BODYSUITS
Women:TOPS_BODYSUITS:87,RIBBED BODYSUIT WITH RUFFLES,Bodysuit with a straight-cut neckline and exposed shoulders. Combined ruffles on the chest. Snap-button fastening at the bottom.,Women,TOPS_BODYSUITS
Women:TOPS_BODYSUITS:88,RIBBED T-SHIRT WITH FOIL,Fitted T-shirt made of metallic-effect cotton. Round neck and short sleeves.,Women,TOPS_BODYSUITS
Women:TOPS_BODYSUITS:89,METALLIC CAMISOLE TOP,Top with a flowing neckline and thin straps that cross at the back.,Women,TOPS_BODYSUITS
Women:TOPS_BODYSUITS:91,STRIPED POPLIN STRAPLESS TOP,Straight-neck top with exposed shoulders. Button details on the front. Invisible side zip fastening.,Women,TOPS_BODYSUITS
Women:TOPS_BODYSUITS:92,DRAPED SATIN TOP,Sleeveless top with a high neck. Draped fabric. Invisible side zip fastening.,Women,TOPS_BODYSUITS
Women:TOPS_BODYSUITS:93,LINEN BLEND PRINT TOP,Crop top made of a linen blend. V-neck and sleeves falling below the elbow. Open back with elastic detail. Gathered hem. Invisible side zip fastening.,Women,TOPS_BODYSUITS
Women:TOPS_BODYSUITS:94,TOP WITH SHOULDER PADS,Sleeveless top featuring a surplice neckline and padded shoulders. Side gathered details. Invisible zip fastening.,Women,TOPS_BODYSUITS
Women:TOPS_BODYSUITS:95,SHINY STRAPLESS TOP,Top with a straight neckline and exposed shoulders. Shiny-effect fabric with smocking at the back. Invisible side zip fastening.,Women,TOPS_BODYSUITS
Women:TOPS_BODYSUITS:96,BEADED PRINTED TOP,"V-neck top with double straps. Adjustable chest with side ties with tassel trims. Beading, sequins and contrast embroidery detail. Matching lining.",Women,TOPS_BODYSUITS
Women:TOPS_BODYSUITS:97,SATIN TOP WITH KNOT,Crop top featuring a V-neckline with a knot and long sleeves. Invisible side zip fastening.,Women,TOPS_BODYSUITS
Women:TOPS_BODYSUITS:98,STRAPLESS TOP WITH ZIP,Off-the-shoulder top with a straight neckline. Front patch pocket. Metallic zip on the hem. Invisible side zip fastening.,Women,TOPS_BODYSUITS
Women:TOPS_BODYSUITS:100,ASYMMETRIC SHAPE BODYSUIT,Sleeveless bodysuit with an asymmetric neckline. Draped fabric detail. Snap-button fastening at the bottom.,Women,TOPS_BODYSUITS
Women:TOPS_BODYSUITS:101,EMBROIDERED TOP,V-neck top with straps. Matching floral embroidery detail and a button-up front.,Women,TOPS_BODYSUITS
Women:TOPS_BODYSUITS:103,MESH SEAMLESS BODYSUIT WITH RHINESTONES,"Bodysuit made of stretchy mesh fabric. Featuring a V-neck, long sleeves, rhinestone appliqués and gathered detailing.",Women,TOPS_BODYSUITS
Women:TOPS_BODYSUITS:104,TRF DENIM BANDEAU TOP,Denim top with a straight-cut neckline and exposed shoulders. Featuring stretch fabric at the back and metal button fastening at the front.,Women,TOPS_BODYSUITS
Women:TOPS_BODYSUITS:106,GATHERED ORGANZA TOP,Halter top with buttons. Gathered fabric detail. Matching lining. Open back.,Women,TOPS_BODYSUITS
Women:TOPS_BODYSUITS:107,SEAMLESS FOIL ASYMMETRIC TOP,Polyamide top with an asymmetric neckline and wide straps. Metallic fabric.,Women,TOPS_BODYSUITS
Women:TOPS_BODYSUITS:109,TEXTURED TOP,Halter top with a surplice neckline. Open back with tied detail at the hem.,Women,TOPS_BODYSUITS
Women:TOPS_BODYSUITS:110,STRAPLESS PLEATED TULLE TOP,Strapless top with inner elastic. Pleated fabric detail. Seamless hem.,Women,TOPS_BODYSUITS
Women:TOPS_BODYSUITS:111,PRINTED CROP TOP,Top with a plunging V-neckline and straps. Featuring multicoloured embroidery and beads. Tied fastening at the back.,Women,TOPS_BODYSUITS
Women:TOPS_BODYSUITS:112,DRAPED TOP,Sleeveless top with a cowl neckline. Featuring gathering on the shoulders.,Women,TOPS_BODYSUITS
Women:TOPS_BODYSUITS:113,KNIT TOP WITH ASYMMETRIC HEM,Open knit top with a round neck and long sleeves. Asymmetric hem.,Women,TOPS_BODYSUITS
Women:TOPS_BODYSUITS:114,TEXTURED TOP,Top made of textured fabric. Featuring a round neck and short sleeves.,Women,TOPS_BODYSUITS
Women:TOPS_BODYSUITS:115,STRETCH KNIT TOP WITH SQUARE NECKLINE,SLIM FIT - SQUARE NECKLINE - NORMAL LENGTH - SLEEVELESSSleeveless top with a square neckline.,Women,TOPS_BODYSUITS
Women:TOPS_BODYSUITS:116,SATIN TOP WITH TOPSTITCHING,Round neck satin top with long sleeves. Contrast pronounced topstitching details.,Women,TOPS_BODYSUITS
Women:TOPS_BODYSUITS:117,PLEATED TOP WITH TIE DETAIL,V-neck top featuring long sleeves with wide cuffs and tie detail at the back.,Women,TOPS_BODYSUITS
Women:TOPS_BODYSUITS:118,VOLUMINOUS TOP,"Sleeveless top featuring a matching ribbed round neck, voluminous hem and invisible back zip fastening.",Women,TOPS_BODYSUITS
Women:TOPS_BODYSUITS:119,HALTER TOP WITH POCKETS,"Halterneck top featuring front patch pockets, a false welt pocket on the chest and front zip fastening hidden by a placket.",Women,TOPS_BODYSUITS
Women:TOPS_BODYSUITS:120,CROP TOP WITH CUTWORK EMBROIDERY,Crop top with a straight neck and wide straps. Featuring matching cutwork embroidery detail.,Women,TOPS_BODYSUITS
Women:TOPS_BODYSUITS:121,TIE-DYE PRINT CROP TOP,Top with a surplice neckline and long sleeves. Gathered hem with pleats. Invisible side zip fastening.,Women,TOPS_BODYSUITS
Women:TOPS_BODYSUITS:122,RUFFLED LINEN TOP,"Sleeveless top made of 100% linen. Featuring a round neckline, ruffles on the front and front button fastening.",Women,TOPS_BODYSUITS
Women:TOPS_BODYSUITS:123,JACQUARD FRILLED TOP,Top with a V-neck and thin straps. Ruffle trim details and a split hem.,Women,TOPS_BODYSUITS
